1508807091.103429 IP 128.253.128.65.52056 > 128.253.128.64.11010: Flags [S], seq 515655576, win 29200, options [mss 1460,sackOK,TS val 1478570096 ecr 0,nop,wscale 7], length 0
E..<w.@.@..W...A...@.X+...G.......r............
X!0p........
1508807091.103546 IP 128.253.128.64.11010 > 128.253.128.65.52056: Flags [S.], seq 2966867894, ack 515655577, win 28960, options [mss 1460,sackOK,TS val 1478612502 ecr 1478570096,nop,wscale 7], length 0
E..<..@.?.9@...@...A+..X......G...q @L.........
X!..X!0p....
1508807091.103559 IP 128.253.128.65.52056 > 128.253.128.64.11010: Flags [.], ack 1, win 229, options [nop,nop,TS val 1478570096 ecr 1478612502], length 0
E..4w.@.@..^...A...@.X+...G................
X!0pX!..
1508807091.103567 IP 128.253.128.65.52056 > 128.253.128.64.11010: Flags [P.], seq 1:278, ack 1, win 229, options [nop,nop,TS val 1478570096 ecr 1478612502], length 277
E..Iw.@.@..H...A...@.X+...G................
X!0pX!..................................16313303838625040399{ "req_id" : "16313303838625040399", "user_id" : "user_0", "movie_id" : "movie_0", "rating" : "5", "text" : "It is a movie review! It is a movie review! It is a movie review! It is a movie review! It is a movie review! " }
1508807091.103657 IP 128.253.128.64.11010 > 128.253.128.65.52056: Flags [.], ack 278, win 235, options [nop,nop,TS val 1478612502 ecr 1478570096], length 0
E..4..@.?......@...A+..X......H......8.....
X!..X!0p
1508807091.103756 IP 128.253.128.64.11010 > 128.253.128.65.52056: Flags [P.], seq 1:25, ack 278, win 235, options [nop,nop,TS val 1478612502 ecr 1478570096], length 24
E..L..@.?......@...A+..X......H.....Y......
X!..X!0p........................
1508807091.103761 IP 128.253.128.65.52056 > 128.253.128.64.11010: Flags [.], ack 25, win 229, options [nop,nop,TS val 1478570096 ecr 1478612502], length 0
E..4w.@.@..\...A...@.X+...H................
X!0pX!..
1508807091.104789 IP 128.253.128.65.52056 > 128.253.128.64.11010: Flags [P.], seq 278:302, ack 25, win 229, options [nop,nop,TS val 1478570097 ecr 1478612502], length 24
E..Lw.@.@..C...A...@.X+...H................
X!0qX!..........................
1508807091.104793 IP 128.253.128.65.52056 > 128.253.128.64.11010: Flags [F.], seq 302, ack 25, win 229, options [nop,nop,TS val 1478570097 ecr 1478612502], length 0
E..4w.@.@..Z...A...@.X+...H................
X!0qX!..
1508807091.104798 IP 128.253.128.65.52056 > 128.253.128.64.11010: Flags [R.], seq 303, ack 25, win 229, options [nop,nop,TS val 1478570097 ecr 1478612502], length 0
E..4w.@.@..Y...A...@.X+...H................
X!0qX!..
1508807091.103429 IP 128.253.128.65.52056 > 128.253.128.64.11010: Flags [S], seq 515655576, win 29200, options [mss 1460,sackOK,TS val 1478570096 ecr 0,nop,wscale 7], length 0
E..<w.@.@..W...A...@.X+...G.......r............
X!0p........
1508807091.103546 IP 128.253.128.64.11010 > 128.253.128.65.52056: Flags [S.], seq 2966867894, ack 515655577, win 28960, options [mss 1460,sackOK,TS val 1478612502 ecr 1478570096,nop,wscale 7], length 0
E..<..@.?.9@...@...A+..X......G...q @L.........
X!..X!0p....
1508807091.103559 IP 128.253.128.65.52056 > 128.253.128.64.11010: Flags [.], ack 1, win 229, options [nop,nop,TS val 1478570096 ecr 1478612502], length 0
E..4w.@.@..^...A...@.X+...G................
X!0pX!..
1508807091.103567 IP 128.253.128.65.52056 > 128.253.128.64.11010: Flags [P.], seq 1:278, ack 1, win 229, options [nop,nop,TS val 1478570096 ecr 1478612502], length 277
E..Iw.@.@..H...A...@.X+...G................
X!0pX!..................................16313303838625040399{ "req_id" : "16313303838625040399", "user_id" : "user_0", "movie_id" : "movie_0", "rating" : "5", "text" : "It is a movie review! It is a movie review! It is a movie review! It is a movie review! It is a movie review! " }
1508807091.103657 IP 128.253.128.64.11010 > 128.253.128.65.52056: Flags [.], ack 278, win 235, options [nop,nop,TS val 1478612502 ecr 1478570096], length 0
E..4..@.?......@...A+..X......H......8.....
X!..X!0p
1508807091.103756 IP 128.253.128.64.11010 > 128.253.128.65.52056: Flags [P.], seq 1:25, ack 278, win 235, options [nop,nop,TS val 1478612502 ecr 1478570096], length 24
E..L..@.?......@...A+..X......H.....Y......
X!..X!0p........................
1508807091.103761 IP 128.253.128.65.52056 > 128.253.128.64.11010: Flags [.], ack 25, win 229, options [nop,nop,TS val 1478570096 ecr 1478612502], length 0
E..4w.@.@..\...A...@.X+...H................
X!0pX!..
1508807091.104789 IP 128.253.128.65.52056 > 128.253.128.64.11010: Flags [P.], seq 278:302, ack 25, win 229, options [nop,nop,TS val 1478570097 ecr 1478612502], length 24
E..Lw.@.@..C...A...@.X+...H................
X!0qX!..........................
1508807091.104793 IP 128.253.128.65.52056 > 128.253.128.64.11010: Flags [F.], seq 302, ack 25, win 229, options [nop,nop,TS val 1478570097 ecr 1478612502], length 0
E..4w.@.@..Z...A...@.X+...H................
X!0qX!..
1508807091.104798 IP 128.253.128.65.52056 > 128.253.128.64.11010: Flags [R.], seq 303, ack 25, win 229, options [nop,nop,TS val 1478570097 ecr 1478612502], length 0
E..4w.@.@..Y...A...@.X+...H................
X!0qX!..
1508807091.103429 IP 128.253.128.65.52056 > 128.253.128.64.11010: Flags [S], seq 515655576, win 29200, options [mss 1460,sackOK,TS val 1478570096 ecr 0,nop,wscale 7], length 0
E..<w.@.@..W...A...@.X+...G.......r............
X!0p........
1508807091.103546 IP 128.253.128.64.11010 > 128.253.128.65.52056: Flags [S.], seq 2966867894, ack 515655577, win 28960, options [mss 1460,sackOK,TS val 1478612502 ecr 1478570096,nop,wscale 7], length 0
E..<..@.?.9@...@...A+..X......G...q @L.........
X!..X!0p....
1508807091.103559 IP 128.253.128.65.52056 > 128.253.128.64.11010: Flags [.], ack 1, win 229, options [nop,nop,TS val 1478570096 ecr 1478612502], length 0
E..4w.@.@..^...A...@.X+...G................
X!0pX!..
1508807091.103567 IP 128.253.128.65.52056 > 128.253.128.64.11010: Flags [P.], seq 1:278, ack 1, win 229, options [nop,nop,TS val 1478570096 ecr 1478612502], length 277
E..Iw.@.@..H...A...@.X+...G................
X!0pX!..................................16313303838625040399{ "req_id" : "16313303838625040399", "user_id" : "user_0", "movie_id" : "movie_0", "rating" : "5", "text" : "It is a movie review! It is a movie review! It is a movie review! It is a movie review! It is a movie review! " }
1508807091.103657 IP 128.253.128.64.11010 > 128.253.128.65.52056: Flags [.], ack 278, win 235, options [nop,nop,TS val 1478612502 ecr 1478570096], length 0
E..4..@.?......@...A+..X......H......8.....
X!..X!0p
1508807091.103756 IP 128.253.128.64.11010 > 128.253.128.65.52056: Flags [P.], seq 1:25, ack 278, win 235, options [nop,nop,TS val 1478612502 ecr 1478570096], length 24
E..L..@.?......@...A+..X......H.....Y......
X!..X!0p........................
1508807091.103761 IP 128.253.128.65.52056 > 128.253.128.64.11010: Flags [.], ack 25, win 229, options [nop,nop,TS val 1478570096 ecr 1478612502], length 0
E..4w.@.@..\...A...@.X+...H................
X!0pX!..
1508807091.104789 IP 128.253.128.65.52056 > 128.253.128.64.11010: Flags [P.], seq 278:302, ack 25, win 229, options [nop,nop,TS val 1478570097 ecr 1478612502], length 24
E..Lw.@.@..C...A...@.X+...H................
X!0qX!..........................
1508807091.104793 IP 128.253.128.65.52056 > 128.253.128.64.11010: Flags [F.], seq 302, ack 25, win 229, options [nop,nop,TS val 1478570097 ecr 1478612502], length 0
E..4w.@.@..Z...A...@.X+...H................
X!0qX!..
1508807091.104798 IP 128.253.128.65.52056 > 128.253.128.64.11010: Flags [R.], seq 303, ack 25, win 229, options [nop,nop,TS val 1478570097 ecr 1478612502], length 0
E..4w.@.@..Y...A...@.X+...H................
X!0qX!..
1508807091.103429 IP 128.253.128.65.52056 > 128.253.128.64.11010: Flags [S], seq 515655576, win 29200, options [mss 1460,sackOK,TS val 1478570096 ecr 0,nop,wscale 7], length 0
E..<w.@.@..W...A...@.X+...G.......r............
X!0p........
1508807091.103546 IP 128.253.128.64.11010 > 128.253.128.65.52056: Flags [S.], seq 2966867894, ack 515655577, win 28960, options [mss 1460,sackOK,TS val 1478612502 ecr 1478570096,nop,wscale 7], length 0
E..<..@.?.9@...@...A+..X......G...q @L.........
X!..X!0p....
1508807091.103559 IP 128.253.128.65.52056 > 128.253.128.64.11010: Flags [.], ack 1, win 229, options [nop,nop,TS val 1478570096 ecr 1478612502], length 0
E..4w.@.@..^...A...@.X+...G................
X!0pX!..
1508807091.103567 IP 128.253.128.65.52056 > 128.253.128.64.11010: Flags [P.], seq 1:278, ack 1, win 229, options [nop,nop,TS val 1478570096 ecr 1478612502], length 277
E..Iw.@.@..H...A...@.X+...G................
X!0pX!..................................16313303838625040399{ "req_id" : "16313303838625040399", "user_id" : "user_0", "movie_id" : "movie_0", "rating" : "5", "text" : "It is a movie review! It is a movie review! It is a movie review! It is a movie review! It is a movie review! " }
1508807091.103657 IP 128.253.128.64.11010 > 128.253.128.65.52056: Flags [.], ack 278, win 235, options [nop,nop,TS val 1478612502 ecr 1478570096], length 0
E..4..@.?......@...A+..X......H......8.....
X!..X!0p
1508807091.103756 IP 128.253.128.64.11010 > 128.253.128.65.52056: Flags [P.], seq 1:25, ack 278, win 235, options [nop,nop,TS val 1478612502 ecr 1478570096], length 24
E..L..@.?......@...A+..X......H.....Y......
X!..X!0p........................
1508807091.103761 IP 128.253.128.65.52056 > 128.253.128.64.11010: Flags [.], ack 25, win 229, options [nop,nop,TS val 1478570096 ecr 1478612502], length 0
E..4w.@.@..\...A...@.X+...H................
X!0pX!..
1508807091.104789 IP 128.253.128.65.52056 > 128.253.128.64.11010: Flags [P.], seq 278:302, ack 25, win 229, options [nop,nop,TS val 1478570097 ecr 1478612502], length 24
E..Lw.@.@..C...A...@.X+...H................
X!0qX!..........................
1508807091.104793 IP 128.253.128.65.52056 > 128.253.128.64.11010: Flags [F.], seq 302, ack 25, win 229, options [nop,nop,TS val 1478570097 ecr 1478612502], length 0
E..4w.@.@..Z...A...@.X+...H................
X!0qX!..
1508807091.104798 IP 128.253.128.65.52056 > 128.253.128.64.11010: Flags [R.], seq 303, ack 25, win 229, options [nop,nop,TS val 1478570097 ecr 1478612502], length 0
E..4w.@.@..Y...A...@.X+...H................
X!0qX!..
1508807091.103429 IP 128.253.128.65.52056 > 128.253.128.64.11010: Flags [S], seq 515655576, win 29200, options [mss 1460,sackOK,TS val 1478570096 ecr 0,nop,wscale 7], length 0
E..<w.@.@..W...A...@.X+...G.......r............
X!0p........
1508807091.103546 IP 128.253.128.64.11010 > 128.253.128.65.52056: Flags [S.], seq 2966867894, ack 515655577, win 28960, options [mss 1460,sackOK,TS val 1478612502 ecr 1478570096,nop,wscale 7], length 0
E..<..@.?.9@...@...A+..X......G...q @L.........
X!..X!0p....
1508807091.103559 IP 128.253.128.65.52056 > 128.253.128.64.11010: Flags [.], ack 1, win 229, options [nop,nop,TS val 1478570096 ecr 1478612502], length 0
E..4w.@.@..^...A...@.X+...G................
X!0pX!..
1508807091.103567 IP 128.253.128.65.52056 > 128.253.128.64.11010: Flags [P.], seq 1:278, ack 1, win 229, options [nop,nop,TS val 1478570096 ecr 1478612502], length 277
E..Iw.@.@..H...A...@.X+...G................
X!0pX!..................................16313303838625040399{ "req_id" : "16313303838625040399", "user_id" : "user_0", "movie_id" : "movie_0", "rating" : "5", "text" : "It is a movie review! It is a movie review! It is a movie review! It is a movie review! It is a movie review! " }
1508807091.103657 IP 128.253.128.64.11010 > 128.253.128.65.52056: Flags [.], ack 278, win 235, options [nop,nop,TS val 1478612502 ecr 1478570096], length 0
E..4..@.?......@...A+..X......H......8.....
X!..X!0p
1508807091.103756 IP 128.253.128.64.11010 > 128.253.128.65.52056: Flags [P.], seq 1:25, ack 278, win 235, options [nop,nop,TS val 1478612502 ecr 1478570096], length 24
E..L..@.?......@...A+..X......H.....Y......
X!..X!0p........................
1508807091.103761 IP 128.253.128.65.52056 > 128.253.128.64.11010: Flags [.], ack 25, win 229, options [nop,nop,TS val 1478570096 ecr 1478612502], length 0
E..4w.@.@..\...A...@.X+...H................
X!0pX!..
1508807091.104789 IP 128.253.128.65.52056 > 128.253.128.64.11010: Flags [P.], seq 278:302, ack 25, win 229, options [nop,nop,TS val 1478570097 ecr 1478612502], length 24
E..Lw.@.@..C...A...@.X+...H................
X!0qX!..........................
1508807091.104793 IP 128.253.128.65.52056 > 128.253.128.64.11010: Flags [F.], seq 302, ack 25, win 229, options [nop,nop,TS val 1478570097 ecr 1478612502], length 0
E..4w.@.@..Z...A...@.X+...H................
X!0qX!..
1508807091.104798 IP 128.253.128.65.52056 > 128.253.128.64.11010: Flags [R.], seq 303, ack 25, win 229, options [nop,nop,TS val 1478570097 ecr 1478612502], length 0
E..4w.@.@..Y...A...@.X+...H................
X!0qX!..
1508807091.103429 IP 128.253.128.65.52056 > 128.253.128.64.11010: Flags [S], seq 515655576, win 29200, options [mss 1460,sackOK,TS val 1478570096 ecr 0,nop,wscale 7], length 0
E..<w.@.@..W...A...@.X+...G.......r............
X!0p........
1508807091.103546 IP 128.253.128.64.11010 > 128.253.128.65.52056: Flags [S.], seq 2966867894, ack 515655577, win 28960, options [mss 1460,sackOK,TS val 1478612502 ecr 1478570096,nop,wscale 7], length 0
E..<..@.?.9@...@...A+..X......G...q @L.........
X!..X!0p....
1508807091.103559 IP 128.253.128.65.52056 > 128.253.128.64.11010: Flags [.], ack 1, win 229, options [nop,nop,TS val 1478570096 ecr 1478612502], length 0
E..4w.@.@..^...A...@.X+...G................
X!0pX!..
1508807091.103567 IP 128.253.128.65.52056 > 128.253.128.64.11010: Flags [P.], seq 1:278, ack 1, win 229, options [nop,nop,TS val 1478570096 ecr 1478612502], length 277
E..Iw.@.@..H...A...@.X+...G................
X!0pX!..................................16313303838625040399{ "req_id" : "16313303838625040399", "user_id" : "user_0", "movie_id" : "movie_0", "rating" : "5", "text" : "It is a movie review! It is a movie review! It is a movie review! It is a movie review! It is a movie review! " }
1508807091.103657 IP 128.253.128.64.11010 > 128.253.128.65.52056: Flags [.], ack 278, win 235, options [nop,nop,TS val 1478612502 ecr 1478570096], length 0
E..4..@.?......@...A+..X......H......8.....
X!..X!0p
1508807091.103756 IP 128.253.128.64.11010 > 128.253.128.65.52056: Flags [P.], seq 1:25, ack 278, win 235, options [nop,nop,TS val 1478612502 ecr 1478570096], length 24
E..L..@.?......@...A+..X......H.....Y......
X!..X!0p........................
1508807091.103761 IP 128.253.128.65.52056 > 128.253.128.64.11010: Flags [.], ack 25, win 229, options [nop,nop,TS val 1478570096 ecr 1478612502], length 0
E..4w.@.@..\...A...@.X+...H................
X!0pX!..
1508807091.104789 IP 128.253.128.65.52056 > 128.253.128.64.11010: Flags [P.], seq 278:302, ack 25, win 229, options [nop,nop,TS val 1478570097 ecr 1478612502], length 24
E..Lw.@.@..C...A...@.X+...H................
X!0qX!..........................
1508807091.104793 IP 128.253.128.65.52056 > 128.253.128.64.11010: Flags [F.], seq 302, ack 25, win 229, options [nop,nop,TS val 1478570097 ecr 1478612502], length 0
E..4w.@.@..Z...A...@.X+...H................
X!0qX!..
1508807091.104798 IP 128.253.128.65.52056 > 128.253.128.64.11010: Flags [R.], seq 303, ack 25, win 229, options [nop,nop,TS val 1478570097 ecr 1478612502], length 0
E..4w.@.@..Y...A...@.X+...H................
X!0qX!..

